Date,Announcement,share-link
2021-12-08T08:00:00-05:00,"Reddit Recap 2021: Community Reflections, URL to IRL Moments","['facebook', 'twitter', 'pinterest', 'tumblr', 'reddit']"
2021-07-19T00:00:00-04:00,"Out, Proud and Loud at Reddit, Inc.","['facebook', 'twitter', 'pinterest', 'tumblr', 'reddit']"
2021-05-31T00:00:00-04:00,Reddit Honors AAPI Heritage Month,"['facebook', 'twitter', 'pinterest', 'tumblr', 'reddit']"
2021-05-07T00:00:00-04:00,The State of Voter Access In America,"['facebook', 'twitter', 'pinterest', 'tumblr', 'reddit']"
2021-04-14T00:00:00-04:00,Allyship at Reddit,"['facebook', 'twitter', 'pinterest', 'tumblr', 'reddit']"
2021-04-06T00:00:00-04:00,Reddit and PUBG Flair Up,"['facebook', 'twitter', 'pinterest', 'tumblr', 'reddit']"
2021-03-08T00:00:00-05:00,"Women’s History Month at Reddit, Inc.","['facebook', 'twitter', 'pinterest', 'tumblr', 'reddit']"
2021-02-26T00:00:00-05:00,Scaling Reporting at Reddit,"['facebook', 'twitter', 'pinterest', 'tumblr', 'reddit']"
2021-02-17T00:00:00-05:00,新年快乐/ 새해 복 많이 받으세요 / Lo Sar Bzang’ / Cung Chúc Tân Xuân / Happy Lunar New Year!,"['facebook', 'twitter', 'pinterest', 'tumblr', 'reddit']"
2021-02-10T00:00:00-05:00,Honoring Black History Month at Reddit,"['facebook', 'twitter', 'pinterest', 'tumblr', 'reddit']"
2021-01-13T00:00:00-05:00,Improving Reddit Engineering through GAINS,"['facebook', 'twitter', 'pinterest', 'tumblr', 'reddit']"
2021-01-07T00:00:00-05:00,"In 2020, You Asked Experts Anything","['facebook', 'twitter', 'pinterest', 'tumblr', 'reddit']"
2020-12-11T00:00:00-05:00,"Celebrating 10 Years of “Today You, Tomorrow Me”","['facebook', 'twitter', 'pinterest', 'tumblr', 'reddit']"
2020-11-25T00:00:00-05:00,In Support of the Contract for the Web,"['facebook', 'twitter', 'pinterest', 'tumblr', 'reddit']"
2020-11-03T00:00:00-05:00,It’s Election Day 2020 and We’ve Compiled Some Resources to Help You Vote,"['facebook', 'twitter', 'pinterest', 'tumblr', 'reddit']"
2020-10-30T00:00:00-04:00,Join Us In Supporting Extra Life — A Charity Gaming Marathon Benefiting Children’s Hospitals!,"['facebook', 'twitter', 'pinterest', 'tumblr', 'reddit']"
2020-10-28T00:00:00-04:00,Chilling Tales from Reddit Engineering,"['facebook', 'twitter', 'pinterest', 'tumblr', 'reddit']"
2020-10-24T00:00:00-04:00,Today is the First-Ever Vote Early Day!,"['facebook', 'twitter', 'pinterest', 'tumblr', 'reddit']"
2020-10-20T00:00:00-04:00,What Happens Now? Post-Election Day AMA Series,"['facebook', 'twitter', 'pinterest', 'tumblr', 'reddit']"
2020-10-15T00:00:00-04:00,"Introducing Christina Shareef, Reddit’s Head of Diversity, Inclusion, and Belonging","['facebook', 'twitter', 'pinterest', 'tumblr', 'reddit']"
2020-10-12T00:00:00-04:00,The Great K8S Migration,"['facebook', 'twitter', 'pinterest', 'tumblr', 'reddit']"
2020-10-02T00:00:00-04:00,Reddit Honors Its Latinx Employees for Hispanic Heritage Month,"['facebook', 'twitter', 'pinterest', 'tumblr', 'reddit']"
2020-09-22T00:00:00-04:00,It’s National Voter Registration Day! Register To Vote & Have Your Voice Heard In The 2020 Elections,"['facebook', 'twitter', 'pinterest', 'tumblr', 'reddit']"
2020-09-15T00:00:00-04:00,r/AskHistorians Community Hosts First-Ever Virtual Conference on Reddit,"['facebook', 'twitter', 'pinterest', 'tumblr', 'reddit']"
2020-09-02T00:00:00-04:00,Elevating the Voice of Our Moderators: Reddit’s FCC Comments on Section 230 Rulemaking,"['facebook', 'twitter', 'pinterest', 'tumblr', 'reddit']"
2020-09-01T00:00:00-04:00,It’s National Poll Worker Recruitment Day! Become a Poll Worker this Election and Help Power the Polls in Your Community,"['facebook', 'twitter', 'pinterest', 'tumblr', 'reddit']"
2020-08-25T00:00:00-04:00,Voting In America,"['facebook', 'twitter', 'pinterest', 'tumblr', 'reddit']"
2020-08-24T00:00:00-04:00,Snoosweek: Back & Better than Ever,"['facebook', 'twitter', 'pinterest', 'tumblr', 'reddit']"
2020-08-09T00:00:00-04:00,Reddit Announces Partnership with Penguin Random House For Its First-Ever Virtual Convention,"['facebook', 'twitter', 'pinterest', 'tumblr', 'reddit']"
2020-07-24T00:00:00-04:00,Reddit’s First-Ever Virtual Recruiting Event,"['facebook', 'twitter', 'pinterest', 'tumblr', 'reddit']"
2020-07-21T00:00:00-04:00,Building Scheduled Reports for Ad Campaigns,"['facebook', 'twitter', 'pinterest', 'tumblr', 'reddit']"
2020-07-06T00:00:00-04:00,Making GAINS in Reddit Engineering,"['facebook', 'twitter', 'pinterest', 'tumblr', 'reddit']"
2020-07-01T00:00:00-04:00,Voices Of Change,"['facebook', 'twitter', 'pinterest', 'tumblr', 'reddit']"
2020-06-30T00:00:00-04:00,Public Trust In An Era of Doubt,"['facebook', 'twitter', 'pinterest', 'tumblr', 'reddit']"
2020-05-15T00:00:00-04:00,Reddit Announces New Leadership and Organizational Structure for Reddit Advertising Business,"['facebook', 'twitter', 'pinterest', 'tumblr', 'reddit']"
2020-05-08T00:00:00-04:00,Gearing up for Reddit’s 2020 Internship Program,"['facebook', 'twitter', 'pinterest', 'tumblr', 'reddit']"
2020-02-06T00:00:00-05:00,"New Tagboard Partnership Empowers Local Broadcasters, TV Networks to Share Reddit Community Generated Content","['facebook', 'twitter', 'pinterest', 'tumblr', 'reddit']"
2019-05-15T00:00:00-04:00,Celebrating Game of Thrones on Reddit,"['facebook', 'twitter', 'pinterest', 'tumblr', 'reddit']"
2019-04-08T00:00:00-04:00,"Tomorrow, Congress Votes on Net Neutrality on the House Floor! Hear Directly from Members of Congress at 8pm ET TODAY on Reddit, and Learn What You Can Do to Save Net Neutrality!","['facebook', 'twitter', 'pinterest', 'tumblr', 'reddit']"
2019-03-14T00:00:00-04:00,Evolution of Push Notifications at Reddit,"['facebook', 'twitter', 'pinterest', 'tumblr', 'reddit']"
2019-02-21T00:00:00-05:00,Honoring Black History Month on Reddit,"['facebook', 'twitter', 'pinterest', 'tumblr', 'reddit']"
2019-02-13T00:00:00-05:00,Introducing New Offerings for Performance Advertisers,"['facebook', 'twitter', 'pinterest', 'tumblr', 'reddit']"
2019-02-07T00:00:00-05:00,Style & fashion on Reddit,"['facebook', 'twitter', 'pinterest', 'tumblr', 'reddit']"
2019-01-30T00:00:00-05:00,Announcing CPC ads on Reddit,"['facebook', 'twitter', 'pinterest', 'tumblr', 'reddit']"
2019-01-29T00:00:00-05:00,The Best of Reddit’s Communities in 2018,"['facebook', 'twitter', 'pinterest', 'tumblr', 'reddit']"
2019-01-23T00:00:00-05:00,Health & fitness on Reddit,"['facebook', 'twitter', 'pinterest', 'tumblr', 'reddit']"
2019-01-09T00:00:00-05:00,"Introducing Shariq Rizvi, Reddit’s VP of Ads Products & Engineering","['facebook', 'twitter', 'pinterest', 'tumblr', 'reddit']"
2019-01-08T00:00:00-05:00,Technology on Reddit,"['facebook', 'twitter', 'pinterest', 'tumblr', 'reddit']"
2018-12-18T00:00:00-05:00,Envoy Proxy at Reddit,"['facebook', 'twitter', 'pinterest', 'tumblr', 'reddit']"
2018-12-04T00:00:00-05:00,Reddit’s Year in Review: 2018,"['facebook', 'twitter', 'pinterest', 'tumblr', 'reddit']"
2018-11-28T00:00:00-05:00,The EU Copyright Directive,"['facebook', 'twitter', 'pinterest', 'tumblr', 'reddit']"
2018-11-13T00:00:00-05:00,Holiday on Reddit,"['facebook', 'twitter', 'pinterest', 'tumblr', 'reddit']"
2018-11-03T00:00:00-04:00,Game on! Extra Life Game Day Is Here!,"['facebook', 'twitter', 'pinterest', 'tumblr', 'reddit']"
2018-11-01T00:00:00-04:00,Celebrating our 10th annual Secret Santa on Reddit Gifts,"['facebook', 'twitter', 'pinterest', 'tumblr', 'reddit']"
2018-10-30T00:00:00-04:00,Super Bowl on Reddit,"['facebook', 'twitter', 'pinterest', 'tumblr', 'reddit']"
2018-10-26T00:00:00-04:00,Extra Life is almost here,"['facebook', 'twitter', 'pinterest', 'tumblr', 'reddit']"
2018-10-23T00:00:00-04:00,Announcing: Reddit’s Partnership with Patreon!,"['facebook', 'twitter', 'pinterest', 'tumblr', 'reddit']"
2018-10-19T00:00:00-04:00,Extra Life is Coming!,"['facebook', 'twitter', 'pinterest', 'tumblr', 'reddit']"
2018-10-17T00:00:00-04:00,Politics on Reddit,"['facebook', 'twitter', 'pinterest', 'tumblr', 'reddit']"
2018-10-11T00:00:00-04:00,Down for the Count,"['facebook', 'twitter', 'pinterest', 'tumblr', 'reddit']"
2018-10-02T00:00:00-04:00,Video on Reddit,"['facebook', 'twitter', 'pinterest', 'tumblr', 'reddit']"
2018-09-28T00:00:00-04:00,NBA on Reddit,"['facebook', 'twitter', 'pinterest', 'tumblr', 'reddit']"
2018-09-27T00:00:00-04:00,Gaming on Reddit,"['facebook', 'twitter', 'pinterest', 'tumblr', 'reddit']"
2018-09-25T00:00:00-04:00,It’s US National Voter Registration Day. Are You Registered?,"['facebook', 'twitter', 'pinterest', 'tumblr', 'reddit']"
2018-09-19T00:00:00-04:00,Announcing “Season 2” of Reddit’s Internship Program,"['facebook', 'twitter', 'pinterest', 'tumblr', 'reddit']"
2018-09-12T00:00:00-04:00,Evolving mobile architecture at Reddit,"['facebook', 'twitter', 'pinterest', 'tumblr', 'reddit']"
2018-09-07T00:00:00-04:00,Football on Reddit,"['facebook', 'twitter', 'pinterest', 'tumblr', 'reddit']"
2018-08-29T00:00:00-04:00,Beauty on Reddit,"['facebook', 'twitter', 'pinterest', 'tumblr', 'reddit']"
2018-08-28T00:00:00-04:00,"Reddit at ONA18 in Austin, Texas","['facebook', 'twitter', 'pinterest', 'tumblr', 'reddit']"
2018-08-22T00:00:00-04:00,A Spotlight on Local Media on Reddit,"['facebook', 'twitter', 'pinterest', 'tumblr', 'reddit']"
2018-08-21T00:00:00-04:00,From the desk of Reddit’s cartographer: Original content,"['facebook', 'twitter', 'pinterest', 'tumblr', 'reddit']"
2018-08-10T00:00:00-04:00,Discuss and discover TV with Reddit,"['facebook', 'twitter', 'pinterest', 'tumblr', 'reddit']"
2018-08-06T00:00:00-04:00,Endless Thread: Season One Recap & Episode Artwork,"['facebook', 'twitter', 'pinterest', 'tumblr', 'reddit']"
2018-07-18T00:00:00-04:00,"What I learned from chatting with 7,000 strangers on the internet","['facebook', 'twitter', 'pinterest', 'tumblr', 'reddit']"
2018-07-12T00:00:00-04:00,༼ つ ◕_ ◕ ༽つGive Banos recap༼ つ ◕_ ◕ ༽つ,"['facebook', 'twitter', 'pinterest', 'tumblr', 'reddit']"
2018-07-11T00:00:00-04:00,5 Tips for Advertising on Reddit,"['facebook', 'twitter', 'pinterest', 'tumblr', 'reddit']"
2018-06-22T00:00:00-04:00,Celebrating Pride Month with Reddit,"['facebook', 'twitter', 'pinterest', 'tumblr', 'reddit']"
2018-06-20T00:00:00-04:00,Introducing the News tab,"['facebook', 'twitter', 'pinterest', 'tumblr', 'reddit']"
2018-06-20T00:00:00-04:00,The World Cup on Reddit,"['facebook', 'twitter', 'pinterest', 'tumblr', 'reddit']"
2018-06-19T00:00:00-04:00,2018 Global Reddit Meetup Day Recap,"['facebook', 'twitter', 'pinterest', 'tumblr', 'reddit']"
2018-06-12T00:00:00-04:00,Native video ads are here!,"['facebook', 'twitter', 'pinterest', 'tumblr', 'reddit']"
2018-06-01T00:00:00-04:00,We’ve Got Your Back,"['facebook', 'twitter', 'pinterest', 'tumblr', 'reddit']"
2018-05-24T00:00:00-04:00,Night Mode is finally here!,"['facebook', 'twitter', 'pinterest', 'tumblr', 'reddit']"
2018-05-24T00:00:00-04:00,"It’s an AMA, but with way more horsepower","['facebook', 'twitter', 'pinterest', 'tumblr', 'reddit']"
2018-05-22T00:00:00-04:00,Looking back at r/CircleofTrust,"['facebook', 'twitter', 'pinterest', 'tumblr', 'reddit']"
2018-04-26T00:00:00-04:00,"Join Team Reddit, We’re Hiring!","['facebook', 'twitter', 'pinterest', 'tumblr', 'reddit']"
2018-04-25T00:00:00-04:00,Promoted Posts Are Coming to Our Android Apps,"['facebook', 'twitter', 'pinterest', 'tumblr', 'reddit']"
2018-04-24T00:00:00-04:00,Announcing Reddit and Hackbright’s Strategic Scholarship Fund to Support Women in Tech,"['facebook', 'twitter', 'pinterest', 'tumblr', 'reddit']"
2018-04-23T00:00:00-04:00,Reddit’s Expanding to Chicago!,"['facebook', 'twitter', 'pinterest', 'tumblr', 'reddit']"
2018-04-19T00:00:00-04:00,"Introducing Jen Wong, Reddit’s Chief Operating Officer","['facebook', 'twitter', 'pinterest', 'tumblr', 'reddit']"
2018-04-19T00:00:00-04:00,"Reddit Meetup Day is coming! Set your calendars for June 9, 2018.","['facebook', 'twitter', 'pinterest', 'tumblr', 'reddit']"
2018-03-22T00:00:00-04:00,Reddit Gifts Is Celebrating Its 400th Gift Exchange!,"['facebook', 'twitter', 'pinterest', 'tumblr', 'reddit']"
2018-02-28T00:00:00-05:00,The Evolution of Data at Reddit,"['facebook', 'twitter', 'pinterest', 'tumblr', 'reddit']"
2018-02-05T00:00:00-05:00,The Best of Reddit During Super Bowl LII,"['facebook', 'twitter', 'pinterest', 'tumblr', 'reddit']"
2018-01-18T00:00:00-05:00,Celebrating Ten Years of r/AskReddit,"['facebook', 'twitter', 'pinterest', 'tumblr', 'reddit']"
2018-01-12T00:00:00-05:00,WBUR’s Reddit-Themed Podcast ‘Endless Thread’ Debuts Its Premiere Episode,"['facebook', 'twitter', 'pinterest', 'tumblr', 'reddit']"
2017-12-19T00:00:00-05:00,The Best of Reddit in 2017,"['facebook', 'twitter', 'pinterest', 'tumblr', 'reddit']"
2017-12-18T00:00:00-05:00,Reddit’s Mobile Apps Are Getting a Major Upgrade,"['facebook', 'twitter', 'pinterest', 'tumblr', 'reddit']"
2017-12-13T00:00:00-05:00,Reddit Partners With Microsoft to Deliver Intelligent Search Results and Business Intelligence Tools,"['facebook', 'twitter', 'pinterest', 'tumblr', 'reddit']"
2017-12-11T00:00:00-05:00,An Analysis of Net Neutrality Activism on Reddit,"['facebook', 'twitter', 'pinterest', 'tumblr', 'reddit']"
2017-12-05T00:00:00-05:00,Presenting ‘Endless Thread’: A New Podcast Partnership from Reddit and WBUR,"['facebook', 'twitter', 'pinterest', 'tumblr', 'reddit']"
2017-11-22T00:00:00-05:00,A Very Reddit Thanksgiving,"['facebook', 'twitter', 'pinterest', 'tumblr', 'reddit']"
2017-11-08T00:00:00-05:00,An Update on Reddit’s Redesign,"['facebook', 'twitter', 'pinterest', 'tumblr', 'reddit']"
2017-11-06T00:00:00-05:00,Introducing the New Reddit Ads Dashboard,"['facebook', 'twitter', 'pinterest', 'tumblr', 'reddit']"
2017-11-02T00:00:00-04:00,Secret Santa 2017: Join a Reddit Tradition,"['facebook', 'twitter', 'pinterest', 'tumblr', 'reddit']"
2017-10-30T00:00:00-04:00,"Halloween Highlights: Stranger Pairs, Hallo-memes, and the Jack of All Jack-o’-Lanterns","['facebook', 'twitter', 'pinterest', 'tumblr', 'reddit']"
2017-10-26T00:00:00-04:00,Extra Life 2017: Official Contest Rules,"['facebook', 'twitter', 'pinterest', 'tumblr', 'reddit']"
2017-10-26T00:00:00-04:00,Extra Life Is Almost Here! Join Team Reddit on Nov. 4th to Raise Money for Children’s Hospitals!,"['facebook', 'twitter', 'pinterest', 'tumblr', 'reddit']"
2017-10-20T00:00:00-04:00,Snoo Spotlight: Bhavana Shanbhag,"['facebook', 'twitter', 'pinterest', 'tumblr', 'reddit']"
2017-10-18T00:00:00-04:00,Announcing the Reddit Internship for Engineers (RIFE),"['facebook', 'twitter', 'pinterest', 'tumblr', 'reddit']"
2017-10-12T00:00:00-04:00,Reddit Teams up With TIME on New Editorial Partnership,"['facebook', 'twitter', 'pinterest', 'tumblr', 'reddit']"
2017-10-04T00:00:00-04:00,Extra Life Kicks Off November 4th!,"['facebook', 'twitter', 'pinterest', 'tumblr', 'reddit']"
2017-09-27T00:00:00-04:00,Reddit’s Headed to ONA17!,"['facebook', 'twitter', 'pinterest', 'tumblr', 'reddit']"
2017-09-27T00:00:00-04:00,Reddit Launches AMA Series in Run-Up to the International Day for Tolerance on November 16,"['facebook', 'twitter', 'pinterest', 'tumblr', 'reddit']"
2017-09-25T00:00:00-04:00,Reddit Is Partnering with National Voter Registration Day,"['facebook', 'twitter', 'pinterest', 'tumblr', 'reddit']"
2017-09-13T00:00:00-04:00,Snoo Spotlight: Rohaina Hassan,"['facebook', 'twitter', 'pinterest', 'tumblr', 'reddit']"
2017-09-07T00:00:00-04:00,The Search for Better Search at Reddit,"['facebook', 'twitter', 'pinterest', 'tumblr', 'reddit']"
2017-09-01T00:00:00-04:00,Reddit Co-Founders Share How They Built the Front Page of the Internet With NPR’s Guy Raz,"['facebook', 'twitter', 'pinterest', 'tumblr', 'reddit']"
2017-08-30T00:00:00-04:00,Redditors’ Net Neutrality Comments Filed with FCC,"['facebook', 'twitter', 'pinterest', 'tumblr', 'reddit']"
2017-08-22T00:00:00-04:00,Redditors Collaborate on a Print Magazine That Analyzes the Rise and Fall of Memes,"['facebook', 'twitter', 'pinterest', 'tumblr', 'reddit']"
2017-08-17T00:00:00-04:00,Video Is Coming to Reddit!,"['facebook', 'twitter', 'pinterest', 'tumblr', 'reddit']"
2017-08-10T00:00:00-04:00,Snoo’s Day: A Reddit Tradition,"['facebook', 'twitter', 'pinterest', 'tumblr', 'reddit']"
2017-08-04T00:00:00-04:00,Dynamically Routing Requests Across Different Stacks with VCL,"['facebook', 'twitter', 'pinterest', 'tumblr', 'reddit']"
2017-08-02T00:00:00-04:00,Acing Your Technical Interviews at Reddit,"['facebook', 'twitter', 'pinterest', 'tumblr', 'reddit']"
2017-07-31T00:00:00-04:00,Redditors Across the U.S. Share Net Neutrality Comments for Their Representatives,"['facebook', 'twitter', 'pinterest', 'tumblr', 'reddit']"
2017-07-25T00:00:00-04:00,Holding the Door Open,"['facebook', 'twitter', 'pinterest', 'tumblr', 'reddit']"
2017-07-19T00:00:00-04:00,Reddit Announces First-Ever Olympic AMA Series,"['facebook', 'twitter', 'pinterest', 'tumblr', 'reddit']"
2017-07-14T00:00:00-04:00,Redditors Rally on the Day of Action to Save Net Neutrality,"['facebook', 'twitter', 'pinterest', 'tumblr', 'reddit']"
2017-07-10T00:00:00-04:00,Reddit’s Plans for the Day of Action to Save Net Neutrality,"['facebook', 'twitter', 'pinterest', 'tumblr', 'reddit']"
2017-06-30T00:00:00-04:00,Why We Chose Typescript,"['facebook', 'twitter', 'pinterest', 'tumblr', 'reddit']"
2017-06-30T00:00:00-04:00,Reddit Hosts “Period Party” Fundraiser With Nonprofit Partner Simply the Basics,"['facebook', 'twitter', 'pinterest', 'tumblr', 'reddit']"
2017-06-27T00:00:00-04:00,Highlights from Global Reddit Meetup Day 2017,"['facebook', 'twitter', 'pinterest', 'tumblr', 'reddit']"
2017-06-16T00:00:00-04:00,The MLB Launches New User Profile on Reddit,"['facebook', 'twitter', 'pinterest', 'tumblr', 'reddit']"
2017-06-14T00:00:00-04:00,Why Publishers Should Use Reddit Embeds,"['facebook', 'twitter', 'pinterest', 'tumblr', 'reddit']"
2017-06-08T00:00:00-04:00,Building the Feed for the Reddit iOS App,"['facebook', 'twitter', 'pinterest', 'tumblr', 'reddit']"
2017-06-05T00:00:00-04:00,"What’s New on Reddit Gifts: Arbitrary Day, the MLB, Prequel Memes, & Game of Thrones","['facebook', 'twitter', 'pinterest', 'tumblr', 'reddit']"
2017-06-02T00:00:00-04:00,The Evolution of Code Deploys at Reddit,"['facebook', 'twitter', 'pinterest', 'tumblr', 'reddit']"
2017-05-30T00:00:00-04:00,HQG Studios: The Supergroup of Gif-Makers Reimagining Music Videos,"['facebook', 'twitter', 'pinterest', 'tumblr', 'reddit']"
2017-05-24T00:00:00-04:00,View Counting at Reddit,"['facebook', 'twitter', 'pinterest', 'tumblr', 'reddit']"
2017-05-23T00:00:00-04:00,Dallas Morning News Concludes AMA Series With Mayor of Dallas,"['facebook', 'twitter', 'pinterest', 'tumblr', 'reddit']"
2017-05-16T00:00:00-04:00,Argonauts of the Internet: Anthropology and Community Management,"['facebook', 'twitter', 'pinterest', 'tumblr', 'reddit']"
2017-05-08T00:00:00-04:00,Bravo’s ‘Watch What Happens Live’ Kicks Off Social Week With a Reddit AMA IRL,"['facebook', 'twitter', 'pinterest', 'tumblr', 'reddit']"
2017-05-03T00:00:00-04:00,How Reddit’s Sales Team Is Making The Ad Industry “More Human”,"['facebook', 'twitter', 'pinterest', 'tumblr', 'reddit']"
2017-04-27T00:00:00-04:00,"Global Reddit Meetup Day Is Coming. Set Your Calendars for June 17, 2017!","['facebook', 'twitter', 'pinterest', 'tumblr', 'reddit']"
2017-04-24T00:00:00-04:00,A Quick Recap of the March for Science,"['facebook', 'twitter', 'pinterest', 'tumblr', 'reddit']"
2017-04-18T00:00:00-04:00,Looking Back at r/Place,"['facebook', 'twitter', 'pinterest', 'tumblr', 'reddit']"
2017-04-13T00:00:00-04:00,How We Built r/Place,"['facebook', 'twitter', 'pinterest', 'tumblr', 'reddit']"
2017-04-13T00:00:00-04:00,Announcing GIF Bots on Reddit,"['facebook', 'twitter', 'pinterest', 'tumblr', 'reddit']"
2017-03-30T00:00:00-04:00,Introducing Reddit’s New Self-Serve Advertising Platform,"['facebook', 'twitter', 'pinterest', 'tumblr', 'reddit']"
2017-03-28T00:00:00-04:00,Reddit’s People & Culture Team Hosts Women in Tech Panel,"['facebook', 'twitter', 'pinterest', 'tumblr', 'reddit']"
2017-03-23T00:00:00-04:00,Entertainment Weekly Debuts Latest Cover in Exclusive Post on r/television,"['facebook', 'twitter', 'pinterest', 'tumblr', 'reddit']"
2017-03-22T00:00:00-04:00,Alexis Ohanian Kicks off New Profile by Asking Users How Reddit Changed Their Lives,"['facebook', 'twitter', 'pinterest', 'tumblr', 'reddit']"
2017-03-21T00:00:00-04:00,Introducing a New User Profile Page With u/Shitty_Watercolour,"['facebook', 'twitter', 'pinterest', 'tumblr', 'reddit']"
2017-03-07T00:00:00-05:00,Reddit’s Heading to SXSW!,"['facebook', 'twitter', 'pinterest', 'tumblr', 'reddit']"
2017-03-02T00:00:00-05:00,r/NintendoSwitch Celebrates “Switchmas” With Charity Live Stream,"['facebook', 'twitter', 'pinterest', 'tumblr', 'reddit']"
2017-03-02T00:00:00-05:00,A Look Back at Black History Month at Reddit,"['facebook', 'twitter', 'pinterest', 'tumblr', 'reddit']"
2017-02-22T00:00:00-05:00,IMDB Users Find New Home for Movie Commentary on Reddit,"['facebook', 'twitter', 'pinterest', 'tumblr', 'reddit']"
2017-02-15T00:00:00-05:00,Redditors Take Home Innovation Award at SpaceX’s Hyperloop Competition,"['facebook', 'twitter', 'pinterest', 'tumblr', 'reddit']"
2017-02-08T00:00:00-05:00,Announcing Reddit’s New Partnership With CrowdTangle,"['facebook', 'twitter', 'pinterest', 'tumblr', 'reddit']"
2017-01-31T00:00:00-05:00,Redditors Respond to Alexis Ohanian's Open Letter by Sharing Their Immigration Stories,"['facebook', 'twitter', 'pinterest', 'tumblr', 'reddit']"
2017-01-30T00:00:00-05:00,Reddit Would Not Exist Today Without Immigrants,"['facebook', 'twitter', 'pinterest', 'tumblr', 'reddit']"
2017-01-27T00:00:00-05:00,"Highlights from CEO Steve Huffman's ""State of the Union"" Post","['facebook', 'twitter', 'pinterest', 'tumblr', 'reddit']"
2017-01-23T00:00:00-05:00,The Rise and Rise of Wholesome Memes,"['facebook', 'twitter', 'pinterest', 'tumblr', 'reddit']"
2017-01-19T00:00:00-05:00,Spoiler Tags for Posts,"['facebook', 'twitter', 'pinterest', 'tumblr', 'reddit']"
2017-01-18T00:00:00-05:00,"Redditors' Questions Return to A&E on Leah Remini's ""Ask Me Anything: Part 2""","['facebook', 'twitter', 'pinterest', 'tumblr', 'reddit']"
2015-05-14T00:00:00-04:00,"Promote ideas, protect people","['facebook', 'twitter', 'tumblr', 'reddit']"
2011-05-24T00:00:00-04:00,"reddit, we need to talk…","['facebook', 'twitter', 'tumblr', 'reddit']"
