Date,Announcement,share-link
2024-04-24T12:50:00-04:00,"A Faster, Conversation-First Approach to Feeds in Reddit’s Mobile Apps","['facebook', 'twitter', 'pinterest', 'tumblr', 'reddit']"
2024-04-24T08:00:00-04:00,Expanding our Shopping Ecosystem: Introducing Dynamic Product Ads,"['facebook', 'twitter', 'pinterest', 'tumblr', 'reddit']"
2024-03-27T13:00:00-04:00,Building on Our Partnership With Cision,"['facebook', 'twitter', 'pinterest', 'tumblr', 'reddit']"
2024-03-21T13:45:00-04:00,Reddit is Now a Publicly Traded Company on the New York Stock Exchange,"['facebook', 'twitter', 'pinterest', 'tumblr', 'reddit']"
2024-03-15T10:40:00-04:00,Keeping Our Platform Safe,"['facebook', 'twitter', 'pinterest', 'tumblr', 'reddit']"
2024-03-14T08:00:00-04:00,"Advertise Like a Redditor With Our All-New, Completely Unique Ad Format: Free-Form Ads","['facebook', 'twitter', 'pinterest', 'tumblr', 'reddit']"
2024-03-08T09:00:00-05:00,Introducing the New Toolkit for Business Growth: Reddit Pro is Here,"['facebook', 'twitter', 'pinterest', 'tumblr', 'reddit']"
2024-02-22T15:26:00-05:00,Reddit Files Registration Statement for Proposed Initial Public Offering,"['facebook', 'twitter', 'pinterest', 'tumblr', 'reddit']"
2024-02-22T09:02:00-05:00,Expanding our Partnership with Google,"['facebook', 'twitter', 'pinterest', 'tumblr', 'reddit']"
2024-02-21T11:00:00-05:00,Leading with Community: Reddit Joins Pledge 1%,"['facebook', 'twitter', 'pinterest', 'tumblr', 'reddit']"
2024-02-15T16:16:00-05:00,How Reddit Supports Civic Engagement and Election Integrity in 2024,"['facebook', 'twitter', 'pinterest', 'tumblr', 'reddit']"
2024-01-31T05:00:00-05:00,"Driving advertiser performance through advanced measurement solutions: announcing our first Conversions API partner, Tealium","['facebook', 'twitter', 'pinterest', 'tumblr', 'reddit']"
2023-12-14T06:00:00-05:00,The Key to Unlocking Relevant Audiences? Join Us at CES 2024 To Find Out How,"['facebook', 'twitter', 'pinterest', 'tumblr', 'reddit']"
2023-12-06T09:59:00-05:00,"Wishing Redditors Joy, Cheer, and Bananas This Recap Season","['facebook', 'twitter', 'pinterest', 'tumblr', 'reddit']"
2023-12-01T04:00:00-05:00,Turning Conversations Into Customers: An Update on Our Latest Ad Formats Within Conversation Placement,"['facebook', 'twitter', 'pinterest', 'tumblr', 'reddit']"
2023-11-30T04:00:00-05:00,Bringing Reddit to the World: An Update on Our Internationalization Efforts and New VP of International Growth Role,"['facebook', 'twitter', 'pinterest', 'tumblr', 'reddit']"
2023-11-29T12:07:00-05:00,"Evolving the Reddit Brand: A More Accessible, Bespoke Typography, New Conversation Bubbles and Colors, and a New Snoo Logo - Now with Opposable Thumbs!","['facebook', 'twitter', 'pinterest', 'tumblr', 'reddit']"
2023-10-14T17:05:00-04:00,Reddit’s Response to the Israel-Hamas Conflict,"['facebook', 'twitter', 'pinterest', 'tumblr', 'reddit']"
2023-10-05T03:00:00-04:00,Back by Popular Demand: Announcing All New “Boost 2.0 Certification Program” for Reddit Ads Formula,"['facebook', 'twitter', 'pinterest', 'tumblr', 'reddit']"
2023-10-04T10:29:00-04:00,"New on Reddit - Improved Search Capabilities and Speed, Media Tab, and More","['facebook', 'twitter', 'pinterest', 'tumblr', 'reddit']"
2023-09-25T13:01:00-04:00,Updating Reddit Gold and Rolling Out Our New Contributor Program,"['facebook', 'twitter', 'pinterest', 'tumblr', 'reddit']"
2023-08-31T07:00:00-04:00,Unlocking Advertiser Success Through Enhanced Targeting Capabilities: an Update on our Contextual Tools and ML-powered Keyword Suggestions,"['facebook', 'twitter', 'pinterest', 'tumblr', 'reddit']"
2023-07-31T10:00:00-04:00,"Introducing Fredrick Lee, Reddit’s Chief Information Security Officer","['facebook', 'twitter', 'pinterest', 'tumblr', 'reddit']"
2023-07-26T15:00:00-04:00,Rolling Out an Initial Test for Organizations on Reddit,"['facebook', 'twitter', 'pinterest', 'tumblr', 'reddit']"
2023-06-15T18:01:00-04:00,Key Facts to Understanding Reddit’s Recent API Updates,"['facebook', 'twitter', 'pinterest', 'tumblr', 'reddit']"
2023-06-09T08:00:00-04:00,Investing in what makes Reddit unique: Introducing Contextual Keyword Targeting and Product Ads,"['facebook', 'twitter', 'pinterest', 'tumblr', 'reddit']"
2023-05-02T12:00:00-04:00,Making It Easier to Participate in the Internet’s Best Conversations: Introducing New Ways to Share Reddit Content and Improved Embed Tooling for Publishers,"['facebook', 'twitter', 'pinterest', 'tumblr', 'reddit']"
2023-04-26T08:00:00-04:00,"Introducing Jim Squires, EVP of Business Marketing and Growth, and New Orgs","['facebook', 'twitter', 'pinterest', 'tumblr', 'reddit']"
2023-04-20T03:00:00-04:00,Hallo Amsterdam! Announcing Reddit’s First Regional Sales Hub,"['facebook', 'twitter', 'pinterest', 'tumblr', 'reddit']"
2023-04-19T06:00:00-04:00,Reddit Upvotes Cannes Lions for Another Year: We’re Back With an All-New Activation and All-New Research,"['facebook', 'twitter', 'pinterest', 'tumblr', 'reddit']"
2023-04-18T11:56:00-04:00,Creating a Healthy Ecosystem for Reddit Data and Reddit Data API Access,"['facebook', 'twitter', 'pinterest', 'tumblr', 'reddit']"
2023-04-13T09:00:00-04:00,Reddit's Independent Agency Program Expands with Strategic Partnerships,"['facebook', 'twitter', 'pinterest', 'tumblr', 'reddit']"
2023-04-11T03:00:00-04:00,Find Your People Where Community Grows: Introducing Reddit Garten,"['facebook', 'twitter', 'pinterest', 'tumblr', 'reddit']"
2023-03-29T13:15:00-04:00,Introducing Our 2022 Transparency Report and New Transparency Center,"['facebook', 'twitter', 'pinterest', 'tumblr', 'reddit']"
2023-03-07T10:05:00-05:00,New Features Aimed at Making Reddit Easier to Use: An Update on Our Product Priorities Focused on Simplification,"['facebook', 'twitter', 'pinterest', 'tumblr', 'reddit']"
2023-02-22T17:46:00-05:00,Section 230 Upholds the Internet for Everyday People,"['facebook', 'twitter', 'pinterest', 'tumblr', 'reddit']"
2023-02-09T14:42:00-05:00,Sharing Our Findings Around a Data Security Incident,"['facebook', 'twitter', 'pinterest', 'tumblr', 'reddit']"
2023-01-23T07:00:00-05:00,Expanding Our Senior Leadership Team: Congratulations and Welcome!,"['facebook', 'twitter', 'pinterest', 'tumblr', 'reddit']"
2022-12-14T09:00:00-05:00,Reddit and Omnicom Media Group Announce First-Ever Enterprise Partnership in Canada,"['facebook', 'twitter', 'pinterest', 'tumblr', 'reddit']"
2022-12-12T18:00:00-05:00,"Introducing Durgesh Kaushik, Reddit’s New VP of APAC and Emerging Markets Growth","['facebook', 'twitter', 'pinterest', 'tumblr', 'reddit']"
2022-12-08T08:00:00-05:00,The Reddit Recap Experience Is Back and Available for All,"['facebook', 'twitter', 'pinterest', 'tumblr', 'reddit']"
2022-12-08T08:00:00-05:00,"Revealing This Year’s Reddit Recap, Where We Highlight How Redditors Kept It Real in 2022","['facebook', 'twitter', 'pinterest', 'tumblr', 'reddit']"
2022-12-01T06:00:00-05:00,The Future Is Bright: Unveiling New Research and Our First-Ever Activation at CES 2023,"['facebook', 'twitter', 'pinterest', 'tumblr', 'reddit']"
2022-11-15T06:00:00-05:00,Strengthening our Ads Business Leadership,"['facebook', 'twitter', 'pinterest', 'tumblr', 'reddit']"
2022-11-04T10:00:00-04:00,Reddit Welcomes Dave Habiger to Board of Directors,"['facebook', 'twitter', 'pinterest', 'tumblr', 'reddit']"
2022-10-27T07:00:00-04:00,Announcing Our First Alpha Partners as We Build Out Reddit’s Marketing API Ecosystem,"['facebook', 'twitter', 'pinterest', 'tumblr', 'reddit']"
2022-10-24T12:00:00-04:00,"Introducing EK Chung, Reddit’s New Vice President of User Experience","['facebook', 'twitter', 'pinterest', 'tumblr', 'reddit']"
2022-10-04T09:05:00-04:00,Oterlu Team Joins Reddit to Accelerate Safety Efforts,"['facebook', 'twitter', 'pinterest', 'tumblr', 'reddit']"
2022-09-16T13:29:00-04:00,Hispanic Heritage Month Celebrations at Reddit,"['facebook', 'twitter', 'pinterest', 'tumblr', 'reddit']"
2022-09-14T12:00:00-04:00,Supporting Safe & Fair Elections on Reddit,"['facebook', 'twitter', 'pinterest', 'tumblr', 'reddit']"
2022-09-01T08:00:00-04:00,Reddit Acquires Spiketrap,"['facebook', 'twitter', 'pinterest', 'tumblr', 'reddit']"
2022-08-29T12:30:00-04:00,Growing Our Executive Team with New Leaders,"['facebook', 'twitter', 'pinterest', 'tumblr', 'reddit']"
2022-08-17T12:00:00-04:00,Coming Soon: Reddit Developer Platform,"['facebook', 'twitter', 'pinterest', 'tumblr', 'reddit']"
2022-07-18T10:00:00-04:00,Reddit Turns One Down Under,"['facebook', 'twitter', 'pinterest', 'tumblr', 'reddit']"
2022-07-13T04:00:00-04:00,As Told by Reddit: Underrated UK Staycation Spots,"['facebook', 'twitter', 'pinterest', 'tumblr', 'reddit']"
2022-07-07T08:00:00-04:00,Blockchain-Backed Collectible Avatars Coming to Reddit via New Storefront,"['facebook', 'twitter', 'pinterest', 'tumblr', 'reddit']"
2022-07-01T17:26:00-04:00,The 2022 Midterms On Reddit,"['facebook', 'twitter', 'pinterest', 'tumblr', 'reddit']"
2022-07-01T06:00:00-04:00,"Reddit Acquires Natural Language Processing Company, MeaningCloud, Marking First Reddit Office in Spain","['facebook', 'twitter', 'pinterest', 'tumblr', 'reddit']"
2022-06-30T13:26:00-04:00,PRIDE Month Celebrations at Reddit,"['facebook', 'twitter', 'pinterest', 'tumblr', 'reddit']"
2022-06-29T13:05:00-04:00,Reddit Launches the First-Ever Reddology Guide to Help People Connect to the Communities That Matter to Them Based on Their Astrological Sign,"['facebook', 'twitter', 'pinterest', 'tumblr', 'reddit']"
2022-06-16T11:00:00-04:00,Reddit Acquires Machine-Learning Platform Spell,"['facebook', 'twitter', 'pinterest', 'tumblr', 'reddit']"
2022-06-16T08:00:00-04:00,Reddit and DoubleVerify Announce Partnership to Empower Advertisers With Full Suite Third-Party Ad Measurement Tools,"['facebook', 'twitter', 'pinterest', 'tumblr', 'reddit']"
2022-06-09T09:00:00-04:00,Introducing Reddit’s Explorers Club at Cannes Lions International Festival of Creativity,"['facebook', 'twitter', 'pinterest', 'tumblr', 'reddit']"
2022-05-17T13:03:00-04:00,Finding Balance and Supporting Mental Health at Reddit,"['facebook', 'twitter', 'pinterest', 'tumblr', 'reddit']"
2022-05-16T05:00:00-04:00,Reddit Pulls Love Island Fans For a Chat!,"['facebook', 'twitter', 'pinterest', 'tumblr', 'reddit']"
2022-05-10T13:00:00-04:00,"Welcoming Adriel Frederick, as Vice President of Product, and Announcing Reddit X","['facebook', 'twitter', 'pinterest', 'tumblr', 'reddit']"
2022-05-02T09:48:00-04:00,AAPI Heritage Month: Renew & Rebuild the Community,"['facebook', 'twitter', 'pinterest', 'tumblr', 'reddit']"
2022-04-25T13:00:00-04:00,Bringing Community Ideas to Life with Community Funds,"['facebook', 'twitter', 'pinterest', 'tumblr', 'reddit']"
2022-04-14T08:00:00-04:00,"New on Reddit: Comment Search, Improved Search Results Relevance, Updated Search Design","['facebook', 'twitter', 'pinterest', 'tumblr', 'reddit']"
2022-04-07T09:00:00-04:00,The Day Redditors Broke the Internet… Again,"['facebook', 'twitter', 'pinterest', 'tumblr', 'reddit']"
2022-04-07T08:00:00-04:00,"Reddit Celebrates One Year in Canada, eh?","['facebook', 'twitter', 'pinterest', 'tumblr', 'reddit']"
2022-03-28T08:00:00-04:00,April Fools’ on Reddit is No Joke: Bringing Back r/place,"['facebook', 'twitter', 'pinterest', 'tumblr', 'reddit']"
2022-03-16T08:00:00-04:00,Reddit and WPP Announce Multi-Year Commerce Advisory Partnership,"['facebook', 'twitter', 'pinterest', 'tumblr', 'reddit']"
2022-03-15T13:38:00-04:00,Celebrating Women Every Day at Reddit,"['facebook', 'twitter', 'pinterest', 'tumblr', 'reddit']"
2022-03-03T05:00:00-05:00,Reddit and IPG Mediabrands Announce First Global Enterprise Partnership Agreement,"['facebook', 'twitter', 'pinterest', 'tumblr', 'reddit']"
2022-03-02T19:03:00-05:00,Supporting Ukraine and Our Community,"['facebook', 'twitter', 'pinterest', 'tumblr', 'reddit']"
2022-02-28T15:09:00-05:00,Celebrating Black History Month,"['facebook', 'twitter', 'pinterest', 'tumblr', 'reddit']"
2022-02-24T08:00:00-05:00,"Introducing Our Discover Tab – A New Way to Find Content, Conversations, and Communities on Reddit","['facebook', 'twitter', 'pinterest', 'tumblr', 'reddit']"
2022-02-23T14:12:00-05:00,Sharing Our Community Values,"['facebook', 'twitter', 'pinterest', 'tumblr', 'reddit']"
2022-02-09T12:00:00-05:00,"Adding New Features to Reddit Talk: Recording Function, Web Experiences, Comments and Emojis, and Live Bar","['facebook', 'twitter', 'pinterest', 'tumblr', 'reddit']"
2022-01-31T11:43:00-05:00,Sharing Our Company Values,"['facebook', 'twitter', 'pinterest', 'tumblr', 'reddit']"
2022-01-24T13:25:00-05:00,Introducing New Members to Our Executive Leadership Team,"['facebook', 'twitter', 'pinterest', 'tumblr', 'reddit']"
2022-01-10T08:00:00-05:00,Update to Reddit’s Board of Directors,"['facebook', 'twitter', 'pinterest', 'tumblr', 'reddit']"
2021-12-15T21:08:00-05:00,Reddit Announces Confidential Submission of Draft Registration Statement Related to Proposed Public Offering,"['facebook', 'twitter', 'pinterest', 'tumblr', 'reddit']"
2021-12-08T08:00:00-05:00,Reddit Recap 2021,"['facebook', 'twitter', 'pinterest', 'tumblr', 'reddit']"
2021-12-01T11:00:00-05:00,Introducing New Features to Make Reddit Look and Feel More Lively and In-The-Moment,"['facebook', 'twitter', 'pinterest', 'tumblr', 'reddit']"
2021-11-23T11:00:00-05:00,Bringing More of Dubsmash to Reddit by Launching New Video Features,"['facebook', 'twitter', 'pinterest', 'tumblr', 'reddit']"
2021-11-01T11:00:00-04:00,Reddit and Riot Games Partner to Introduce Avatars for Upcoming League of Legends Show: Arcane,"['facebook', 'twitter', 'pinterest', 'tumblr', 'reddit']"
2021-10-30T15:00:00-04:00,Join Us in Supporting Extra Life — A Charity Gaming Marathon Benefiting Children’s Hospitals!,"['facebook', 'twitter', 'pinterest', 'tumblr', 'reddit']"
2021-10-26T02:00:00-04:00,Hallo and Guten Tag! Reddit Is Coming to Germany,"['facebook', 'twitter', 'pinterest', 'tumblr', 'reddit']"
2021-10-18T08:00:00-04:00,"Reddit and Adobe Join Forces Once Again to Launch All-New, Original Event: Photoshop Battles Live","['facebook', 'twitter', 'pinterest', 'tumblr', 'reddit']"
2021-10-13T11:00:00-04:00,A New Way to Interact on Reddit: Predictions,"['facebook', 'twitter', 'pinterest', 'tumblr', 'reddit']"
2021-10-11T08:00:00-04:00,"Introducing Pali Bhat, Reddit’s First Chief Product Officer","['facebook', 'twitter', 'pinterest', 'tumblr', 'reddit']"
2021-09-21T02:00:00-04:00,London Calling: One Year On,"['facebook', 'twitter', 'pinterest', 'tumblr', 'reddit']"
2021-09-08T00:00:00-04:00,"Introducing Michelle Reynolds, Reddit’s Chief Accounting Officer","['facebook', 'twitter', 'pinterest', 'tumblr', 'reddit']"
2021-09-02T05:00:00-04:00,Reddit Launches Conversation Placement for Advertisers to Reach Users When They are Most Engaged,"['facebook', 'twitter', 'pinterest', 'tumblr', 'reddit']"
2021-08-18T00:00:00-04:00,"Introducing Jonathan Flesher, Reddit’s VP of Business Development","['facebook', 'twitter', 'pinterest', 'tumblr', 'reddit']"
2021-08-12T00:00:00-04:00,Reddit Secures Funding to Continue Growth Plans,"['facebook', 'twitter', 'pinterest', 'tumblr', 'reddit']"
2021-08-02T00:00:00-04:00,"Introducing Timo Pelz, Reddit’s VP of Business Marketing","['facebook', 'twitter', 'pinterest', 'tumblr', 'reddit']"
2021-07-11T00:00:00-04:00,Reddit Upvotes The Land Down Under,"['facebook', 'twitter', 'pinterest', 'tumblr', 'reddit']"
2021-06-01T00:00:00-04:00,Reddit’s Cultural DNA: A Year Look Back and Onward,"['facebook', 'twitter', 'pinterest', 'tumblr', 'reddit']"
2021-05-13T00:00:00-04:00,Introducing Reddit’s First In-House Creative Strategy Agency for Advertisers: KarmaLab,"['facebook', 'twitter', 'pinterest', 'tumblr', 'reddit']"
2021-03-29T00:00:00-04:00,Reddit Sets Up Shop in Canada,"['facebook', 'twitter', 'pinterest', 'tumblr', 'reddit']"
2021-03-22T00:00:00-04:00,"Introducing Laura Nestler, Reddit’s VP of Community","['facebook', 'twitter', 'pinterest', 'tumblr', 'reddit']"
2021-03-11T00:00:00-05:00,Reddit and Omnicom Media Group Announce Flagship Enterprise Partnership Agreement,"['facebook', 'twitter', 'pinterest', 'tumblr', 'reddit']"
2021-03-09T00:00:00-05:00,Standing with our AAPI Community,"['facebook', 'twitter', 'pinterest', 'tumblr', 'reddit']"
2021-03-05T00:00:00-05:00,"Introducing Drew Vollero, Reddit’s Chief Financial Officer","['facebook', 'twitter', 'pinterest', 'tumblr', 'reddit']"
2021-02-08T00:00:00-05:00,Diving into Super Bowl LV Chatter on Reddit,"['facebook', 'twitter', 'pinterest', 'tumblr', 'reddit']"
2021-02-08T00:00:00-05:00,Fueling Reddit’s Future,"['facebook', 'twitter', 'pinterest', 'tumblr', 'reddit']"
2021-01-28T00:00:00-05:00,Introducing a New Reddit AMA Series: Everything You Want to Know About COVID-19 Vaccines,"['facebook', 'twitter', 'pinterest', 'tumblr', 'reddit']"
2020-12-16T00:00:00-05:00,"Reddit and Oracle Data Cloud Team Up to Provide Independent, Third-Party Verification Around Reddit Ad Views","['facebook', 'twitter', 'pinterest', 'tumblr', 'reddit']"
2020-12-13T00:00:00-05:00,Reddit Welcomes Video Platform Dubsmash to Team,"['facebook', 'twitter', 'pinterest', 'tumblr', 'reddit']"
2020-12-08T00:00:00-05:00,Reddit’s 2020 Year in Review – Community Reflections,"['facebook', 'twitter', 'pinterest', 'tumblr', 'reddit']"
2020-12-08T00:00:00-05:00,Reddit’s 2020 Year in Review,"['facebook', 'twitter', 'pinterest', 'tumblr', 'reddit']"
2020-12-08T00:00:00-05:00,Reddit’s 2020 UK Year in Review,"['facebook', 'twitter', 'pinterest', 'tumblr', 'reddit']"
2020-11-20T00:00:00-05:00,Reddit Welcomes Paula Price to Board of Directors,"['facebook', 'twitter', 'pinterest', 'tumblr', 'reddit']"
2020-10-27T00:00:00-04:00,Evolving Reddit’s Workforce,"['facebook', 'twitter', 'pinterest', 'tumblr', 'reddit']"
2020-10-19T00:00:00-04:00,The Internet’s Largest Collaborative Canvas Returns to Reddit with r/Layer ‘Season Two’ in Partnership with Adobe,"['facebook', 'twitter', 'pinterest', 'tumblr', 'reddit']"
2020-09-28T00:00:00-04:00,Reddit Launches London Operation with Mission to Grow UK Community and Advertising Business,"['facebook', 'twitter', 'pinterest', 'tumblr', 'reddit']"
2020-09-24T00:00:00-04:00,Introducing Inventory Types,"['facebook', 'twitter', 'pinterest', 'tumblr', 'reddit']"
2020-07-29T00:00:00-04:00,Up the Vote: Reddit’s IRL 2020 Voting Campaign,"['facebook', 'twitter', 'pinterest', 'tumblr', 'reddit']"
2020-07-15T00:00:00-04:00,Introducing Reddit Image Galleries,"['facebook', 'twitter', 'pinterest', 'tumblr', 'reddit']"
2020-06-10T00:00:00-04:00,Reddit Welcomes Michael Seibel to Board of Directors,"['facebook', 'twitter', 'pinterest', 'tumblr', 'reddit']"
2020-06-01T00:00:00-04:00,Remember the Human – Black Lives Matter,"['facebook', 'twitter', 'pinterest', 'tumblr', 'reddit']"
2020-05-26T00:00:00-04:00,How Reddit is Supporting its Snoos During COVID-19,"['facebook', 'twitter', 'pinterest', 'tumblr', 'reddit']"
2020-04-30T00:00:00-04:00,Reddit Announces First Gaming Data Partnership with Newzoo,"['facebook', 'twitter', 'pinterest', 'tumblr', 'reddit']"
2020-03-31T00:00:00-04:00,It’s Census Day in the US. Here’s What You Need To Know.,"['facebook', 'twitter', 'pinterest', 'tumblr', 'reddit']"
2020-03-24T00:00:00-04:00,"Introducing Reddit Polls, An All-New Post Type","['facebook', 'twitter', 'pinterest', 'tumblr', 'reddit']"
2020-03-09T00:00:00-04:00,Introducing Reddit’s New Offering for Advertisers: Trending Takeover,"['facebook', 'twitter', 'pinterest', 'tumblr', 'reddit']"
2020-03-05T00:00:00-05:00,Women Around the World Find Community on Reddit,"['facebook', 'twitter', 'pinterest', 'tumblr', 'reddit']"
2020-03-04T00:00:00-05:00,Reddit’s Partnership with Crisis Text Line,"['facebook', 'twitter', 'pinterest', 'tumblr', 'reddit']"
2020-03-02T00:00:00-05:00,Expert Conversation on Coronavirus,"['facebook', 'twitter', 'pinterest', 'tumblr', 'reddit']"
2020-02-07T00:00:00-05:00,"Introducing Nellie Peshkov, Reddit’s VP of People & Culture","['facebook', 'twitter', 'pinterest', 'tumblr', 'reddit']"
2020-02-03T00:00:00-05:00,One-to-One and Subreddit Chat: It’s Finally Here,"['facebook', 'twitter', 'pinterest', 'tumblr', 'reddit']"
2020-01-27T00:00:00-05:00,Reddit To Launch AMA Series Heading Into Tokyo 2020 Olympic and Paralympic Games,"['facebook', 'twitter', 'pinterest', 'tumblr', 'reddit']"
2019-12-17T00:00:00-05:00,Xbox and Reddit Link Up,"['facebook', 'twitter', 'pinterest', 'tumblr', 'reddit']"
2019-12-04T00:00:00-05:00,Reddit’s 2019 Year in Review,"['facebook', 'twitter', 'pinterest', 'tumblr', 'reddit']"
2019-11-25T00:00:00-05:00,In Support of the Contract for the Web,"['facebook', 'twitter', 'pinterest', 'tumblr', 'reddit']"
2019-10-23T00:00:00-04:00,Join Us In Supporting Extra Life — A 24-Hour Gaming Marathon Benefiting Children’s Hospitals!,"['facebook', 'twitter', 'pinterest', 'tumblr', 'reddit']"
2019-10-16T00:00:00-04:00,Hearing on “Fostering a Healthier Internet to Protect Consumers”,"['facebook', 'twitter', 'pinterest', 'tumblr', 'reddit']"
2019-10-14T00:00:00-04:00,New Snapchat Integration Enables Direct Sharing of Reddit Content,"['facebook', 'twitter', 'pinterest', 'tumblr', 'reddit']"
2019-10-07T00:00:00-04:00,"Introducing Benjamin Lee, Reddit’s VP and General Counsel in Executive","['facebook', 'twitter', 'pinterest', 'tumblr', 'reddit']"
2019-10-01T00:00:00-04:00,Announcing the 2020 Reddit Internship Program!,"['facebook', 'twitter', 'pinterest', 'tumblr', 'reddit']"
2019-09-30T00:00:00-04:00,Gen Z on Reddit,"['facebook', 'twitter', 'pinterest', 'tumblr', 'reddit']"
2019-09-26T00:00:00-04:00,The Big Count: A Reddit AMA Series Demystifying the 2020 Census,"['facebook', 'twitter', 'pinterest', 'tumblr', 'reddit']"
2019-09-25T00:00:00-04:00,Introducing Our Improved Video Ad Offerings,"['facebook', 'twitter', 'pinterest', 'tumblr', 'reddit']"
2019-09-20T00:00:00-04:00,The Power of Community on Reddit,"['facebook', 'twitter', 'pinterest', 'tumblr', 'reddit']"
2019-08-15T00:00:00-04:00,Reddit Expands Midwest Presence with First Chicago Office,"['facebook', 'twitter', 'pinterest', 'tumblr', 'reddit']"
2019-08-05T00:00:00-04:00,"Introducing Saad Rehmani, Reddit’s VP of Engineering","['facebook', 'twitter', 'pinterest', 'tumblr', 'reddit']"
2019-07-29T00:00:00-04:00,The Benefits of Machine Learning to Study Small Dataset of Social Conversations,"['facebook', 'twitter', 'pinterest', 'tumblr', 'reddit']"
2019-07-24T00:00:00-04:00,Introducing Reddit Community Awards,"['facebook', 'twitter', 'pinterest', 'tumblr', 'reddit']"
2019-06-13T00:00:00-04:00,We’ve (Still) Got Your Back,"['facebook', 'twitter', 'pinterest', 'tumblr', 'reddit']"
2019-06-10T00:00:00-04:00,"On June 11, the Senate will Discuss Net Neutrality. Call Your Senator, then Watch the Proceedings LIVE.","['facebook', 'twitter', 'pinterest', 'tumblr', 'reddit']"
2019-05-28T00:00:00-04:00,Reddit Welcomes Porter Gale to Board of Directors,"['facebook', 'twitter', 'pinterest', 'tumblr', 'reddit']"
2019-05-10T00:00:00-04:00,"Reddit Global Meetup is coming! Set your calendars for June 22, 2019","['facebook', 'twitter', 'pinterest', 'tumblr', 'reddit']"
2019-05-09T00:00:00-04:00,Introducing Reddit Dublin!,"['facebook', 'twitter', 'pinterest', 'tumblr', 'reddit']"
2019-04-30T00:00:00-04:00,"Reddit NYC is Growing, Join Us!","['facebook', 'twitter', 'pinterest', 'tumblr', 'reddit']"
2019-03-20T00:00:00-04:00,ERROR: COPYRIGHT NOT DETECTED. What EU Redditors Can Expect to See Today and Why It Matters,"['facebook', 'twitter', 'pinterest', 'tumblr', 'reddit']"
2019-01-31T00:00:00-05:00,Insights from Data Science Leadership Panel at Reddit,"['facebook', 'twitter', 'pinterest', 'tumblr', 'reddit']"
2023-12-06T10:11:00-05:00,"Desejando aos redditors alegria, felicidade e bananas neste período de Recap","['facebook', 'twitter', 'pinterest', 'tumblr', 'reddit']"
2023-12-06T10:10:00-05:00,Nous te souhaitons un joyeux Recap et beaucoup de bananes !,"['facebook', 'twitter', 'pinterest', 'tumblr', 'reddit']"
2023-12-06T10:09:00-05:00,"En esta temporada de Recaps, les deseamos alegría, felicidad y plátanos a nuestros redditors","['facebook', 'twitter', 'pinterest', 'tumblr', 'reddit']"
2023-12-06T00:00:00-05:00,"Wir wünschen allen Redditor*innen viel Spaß, Freude und Bananen in dieser Recap-Saison","['facebook', 'twitter', 'pinterest', 'tumblr', 'reddit']"
2023-11-30T04:00:00-05:00,Reddit wird international: Ein Update zu unseren Plänen für die Internationalisierung und zur neuen Position VP of International Growth,"['facebook', 'twitter', 'pinterest', 'tumblr', 'reddit']"
2023-11-30T04:00:00-05:00,Propulser Reddit sur la scène internationale : nouvelles concernant nos projets d’internationalisation et la création d’un nouveau poste de Vice-président chargé de la Croissance internationale,"['facebook', 'twitter', 'pinterest', 'tumblr', 'reddit']"
2023-04-20T03:00:00-04:00,Hallo Amsterdam! Reddits erster regionaler Sales Hub kommt,"['facebook', 'twitter', 'pinterest', 'tumblr', 'reddit']"
2023-04-20T03:00:00-04:00,Bonjour Amsterdam ! C’est avec joie que nous vous annonçons l’ouverture du tout premier centre de vente régional Reddit.,"['facebook', 'twitter', 'pinterest', 'tumblr', 'reddit']"
2023-04-20T03:00:00-04:00,Hallo Amsterdam! De eerste regionale saleshub van Reddit is geopend,"['facebook', 'twitter', 'pinterest', 'tumblr', 'reddit']"
2022-12-08T08:00:00-05:00,"Revealing This Year’s Reddit UK Recap, Where We Highlight How Redditors Kept It Real in 2022","['facebook', 'twitter', 'pinterest', 'tumblr', 'reddit']"
2022-12-08T08:00:00-05:00,"Revealing This Year’s Reddit Australia Recap, Where We Highlight How Redditors Kept It Real in 2022","['facebook', 'twitter', 'pinterest', 'tumblr', 'reddit']"
2022-12-08T08:00:00-05:00,"Revealing This Year’s Reddit Canada Recap, Where We Highlight How Redditors Kept It Real in 2022","['facebook', 'twitter', 'pinterest', 'tumblr', 'reddit']"
